Type,Speaker,Topic,Year
Poster,"Abdul Basit Adeel, Ibrahim Enes Atac",How Electoral Dynamics Affect Sentiments Against Refugees: A Natural Experimental Analysis of Roughly 4 Hundred Thousand Tweets On Syrian Refugees In Turkey,2024
Poster,"Chris Riedl, David Lazer, Mauricio Santillana, Tamanna I. Urmi",Human Behavior Dynamics and Thermostatic Response to Public Health Crises Shows Collective Adaptation: a COVID-19 Case Study,2024
Poster,"Juho Kim, Michael Guerzhoy",Observing the Southern US Culture of Honor using Large-Scale Social Media Analysis,2024
Poster,"Maxwell Li, Qiwei Han",The open secrets of the model or marginalized minority: Political campaign participation of Asian Americans in the 21st century,2024
Poster,"Julia Hsin-Ping Hsu, Myeong Lee, Rodrigo Plaza, Ron Mahabir, Victoria Gonzales, Zhehan Zhang",Collaborating to Success: Analyzing the Collaboration Networks of Gaming YouTubers,2024
Poster,Mengqi Zhang,"Strategy of Information Disclosure, Receiver Heterogeneity and Mechanism Design",2024
Poster,"Gabriella Harari, Sumer Vaid, Mahnaz Roshanaei",Social Interactions in the Era of Multiple Channels: a Media Richness Perspective,2024
Poster,"Ksenia Mukhina, Maximilian Schich",Learning geo-socio-visual attention patterns regarding the city of Rome,2024
Poster,"Alvan Arulandu, Brian Lee Zhou",Speeches to Interventions: Forecasting Scalar UN Peacekeeping Deployments from UN General Assembly Debates and Historical Intervention Data,2024
Poster,"Alexandria Leto, David Rothschild, Maria Leonor Pacheco, Elliot E. Pickens",Selecting Facts and Frames: Misinforming About the Economy Without Telling a Lie,2024
Poster,Sukie Xiuqi Yang,"Think Globally, Plan Nationally: Examining National Adoption of Climate Change Education Policies",2024
Poster,"Ashton Anderson, Harsh Kumar, Jonathan Vincentius",Evaluating the Impact of Generative AI on Human Creativity: A Randomized Experiment,2024
Poster,"Armin Shams, Christina Thorpe, Matt Bowden",Building Societal Resilience against Child Grooming using Digital Technologies: The Solution Design,2024
Poster,"Aritra Dasgupta, Jun Yuan, Vrushali Koli",A Communicative Intent Model for Classifying Socially Mediated Crisis Information,2024
Poster,Yunus Emre Tapan,Dynamics of Digital Dialogues: The Co-evolution of Epistemic Elite Networks On Twitter,2024
Poster,"Keith Burghardt, Kristina Lerman, Nathan Bartley",Measuring Impact of Personalized Timelines in Agent-based Simulations of Social Networks,2024
Poster,"Byungkyu Lee, Junsol Kim",Am I the Asshole? The Danger of Cultural Homogenization in the Era of Generative AI,2024
Poster,"Bruno Lepri, Ciro Beneduce, Massimiliano Luca",LLMs Are Zero-Shot Next-Location Predictors,2024
Poster,"Samuel Martin-Gutierrez, Sina Sajjadi",Unveiling homophily beyond the pool of opportunities,2024
Poster,"David Rothschild, Duncan J. Watts, Samar Haider",Mapping the U.S. News Landscape,2024
Poster,"Anthony Cusimano, Jiayu Zheng, Louis Chu, Renzhe Yu",What You Do vs. Who You Are: Evaluating the Value of Administrative Records and Behavioral Traces in Predictive Modeling in Education,2024
Poster,"Rongxin Ouyang, Subhayan Mukerjee, Tian Yang, Yilang Peng",The Effect of Deplatforming Donald Trump on Media Coverage and Audience Engagement,2024
Poster,Xinfeng Gu,Harmonizing Hierarchies? Exploring the Evolution of Musical Tastes Among the Elite,2024
Poster,"Amy Hagopian, Emma Spiro, Ihsan Kahveci, Zack Almquist",Building Resilient Networks for Emergency Preparedness: Utilizing Social Ties for Natural Hazard and Disaster Communication Among People Experiencing Homelessness,2024
Poster,"Jaehong Kim, Sunna Jang, Wonjae Lee, Youngik Lee",Exploratory Study on Public Hate Speech Surrounding the 20th South Korean Presidential Election,2024
Poster,"Bong Gwan Jun, Youngik Lee, Yuwon Chun",Streaming Beyond Borders: Unraveling Viewer Preferences in the Netflix Multiverse,2024
Poster,"Lanu Kim, Suhyoung Choi, Taegyoon Kim",The reproduce of annotator bias in machine using intended bias simulation,2024
Poster,"Jinghui Chen, Takayuki Mizuno",X-based Link Analysis and Relation Detection with Political Campaign Donations,2024
Poster,Filipi Nascimento Silva,Identifying Emerging Trends: Leveraging LLMs and Visualization for Narrative Analysis in Social Media Data,2024
Poster,You Rok Do,Dynamics of Pandemic Parenting Online: A Three-year Analysis of A Korean Online Parenting Forum during COVID-19,2024
Poster,Sara Mesquita,Socioeconomic and environmental factors causing healthcare seeking behaviour: impact of COVID-19 pandemic,2024
Poster,"Kokil Jaidka, Shaz Furniturewala","Trends, Rumors, and Opinions: An Audit of LLMs for political information seeking",2024
Poster,"Alessia Melegaro, Dirk Hovy, Duilio Balsamo, Federico Bianchi, Lorenzo Lucchini, Nicoletta Balbo",Mapping Emotional Landscapes during the COVID-19 Pandemic,2024
Poster,Baoqi Eileen Chen,Clustering daily patterns of American time use from 2003 to 2022,2024
Poster,"Hamed Alhoori, Miftahul Jannat Mokarrama",Examining the Representation of Youth in the US Policy Documents through the Lens of Research,2024
Poster,"Aparna Ananthasubramaniam, Daniel Romero, David Jurgens",Macroeconomic Context Moderates Socioeconomic Determinants of Suicide,2024
Poster,Siyun Gan,The Paradox of Meritocracy? A Bayesian Multilevel Perspective on Contextual Factors and Meritocratic Beliefs,2024
Poster,Megan M. Wisniewski,From Job Descriptions to Occupations: Using Neural Language Models to Code Job Data,2024
Poster,Michael Guerzhoy,Observing the Southern US Culture of Honor using Large-Scale Social Media Analysis,2024
Poster,Regina Ruane,Political Speech as a Forecasting Tool for Democratic Backsliding,2024
Poster,Neeti Pokhriyal,How to quantify participation biases in digital data,2024
Poster,"Subhayan Mukerjee, Tian Yang, Xuzhen Yang, Yilang Peng","Partisan, Unreliable, Digital-Born, and Mass-Oriented Media are More Likely to Thrive on Social Media: A Comparison between Twitter, Facebook, YouTube, and the Web",2024
Poster,"Chris Kempes, Sidney Redner, Vicky Chuqiao Yang, Hyejin Youn",Towards a unified science of regulatory costs in complex adaptive systems,2024
Keynote,Dirk Helbing,"Societies are complex systems. So, how to manage them?",2024
Keynote,"Talia Stroud, Chad P. Kiewiet De Jonge, Kevin Munger", Meta Panel,2024
Keynote,Talal Rahwan,A Global Perspective of Scientists and Editors,2024
Keynote,Amy Orben,"Screen Savers, Protecting Adolescent Mental Health in a Digital World",2024
Keynote,Dan Jurafsky,"Using NLP to Study Social Questions, Police-Community Relations and the Politics of Immigration",2024
Keynote,Elizabeth Bruch,"Date Like a Local, Pursuing Romantic Partners in U.S. Cities",2024
Keynote,Divya Sharma,"Privacy Engineering on the Ground, Problems, Principles, Perspectives",2024
Keynote,Matthew Gentzkow,"Market Power in Web Search, Evidence from a Field Experiment",2024
Keynote,Desmond Patton,"AI for Gun Violence Prevention, Helpful or Harmful?",2024
Keynote,Jevin West,Misinformation in and about science,2023
Keynote,Linda Steg,Encouraging pro-environmental actions,2023
Keynote,Sharad Goel,Everything but the Kitchen Sink,2023
Keynote,Molly J Crockett,Algorithm-Mediated Social Learning and the Cultural Evolution of Morality,2023
Keynote,Lisa Anne Hendriks,Measuring and Mitigating Harm in AI Generated Language,2023
Keynote,Stefan Gössling,"Transport, mobilities, and climate change: Is there an Avenger moment?",2023
Keynote,Joanna Bryson,Science and Power in the Context of AI Policy,2023
Keynote,Tim Althoff,How Human-AI Collaboration Can Improve Mental Health,2023
Keynote,Lauren Brent,Friendship in animals: Adventures in network science and how an evolutionary perspective helps us better understand human health and behaviour.,2023
Keynote,Esteban Moro,Understanding urban social resilience through behavioral mobility data.,2023
Plenary talks,"Jonas L Juul, Jon Kleinberg",The dynamics of writing style in scientific collaborations,2023
Plenary talks,"Chloe Ahn, Xinyi Wang"," ""Performative Capitalism in Silicon Valley: Examining Performative and Substantive Political Behaviors of U.S. Technology Companies""",2023
Plenary talks,"Giuseppe Russo, luca verginer, Manoel Horta Ribeiro, Giona Casiraghi",Spillover of Antisocial Behavior from Fringe Platforms: The Unintended Consequences of Community Banning,2023
Plenary talks,"Almog Simchon, Adam Sutton, Matthew Edwards, Stephan Lewandowsky",The Microtargeting Manipulation Machine,2023
Plenary talks,"Arianna Pera, Manuel Vimercati, Matteo Palmonari",Sentence-Level Explanations of Word Embeddings Associations,2023
Plenary talks,"Mohammed Alsobay, Abdullah Almaatouq, David G. Rand, Duncan J. Watts",Mapping the Effect of Altruistic Punishment on Cooperation,2023
Plenary talks,"Sara Venturini, Satyaki Sikdar, Francesco Rinaldi, Francesco Tudisco, Santo Fortunato",Social Contagion in Science,2023
Plenary talks,"Isabella Loaiza, Takahiro Yabe, Alex Pentland",Big Moves: Tactics for early career success,2023
Plenary talks,"Silvia De Sojo Caso, Mia Ann Jørgensen, Sune Lehmann, Laura Alessandretti",The motherhood penalty in mobility,2023
Plenary talks,"Emil Bakkensen Johansen, Mathias Wullum Nielsen",Momentary Symbols: Tracing the Visual Expressions of Protest Movements,2023
Plenary talks,"Rubén Rodríguez Casañ, Antonio Ariño Villarroya",Prostitution in the digital age: a case study for Spain,2023
Plenary talks,"Sunny Rai, Ashley Francisco, Salvatore Giorgi, Brenda Curtis, Lyle Ungar, Sharath Chandra Guntuku",Studying Racial Heterogeneity in Language Markers of Depression,2023
Plenary talks,"Allison Koenecke, Eric Giannella, Robb Willer, Sharad Goel",Popular Support for Equity in Algorithmic Decision-Making: A Case Study in Online Welfare Ads,2023
Plenary talks,"Ziv Epstein, Hause Lin",Quantifying attention via dwell time and engagement in a social media browsing environment,2023
Plenary talks,"Levin Brinkmann, Bramantyo Supriyatno, Iyad Rahwan",Exploring the Evolution of Artistic Styles Using Generative AI and Influence Modeling,2023
Plenary talks,"Sandro Ferreira Sousa, Vincenzo Nicosia",Quantifying ethnic segregation in cities through random walks,2023
Agent-based modeling,"Alexander Waagen, Charles Martin, Tasi-ching Lu","Fast Prediction of Interdependent Economic, Social, and Transportation Flows in an Adversarial Environment",2020
Agent-based modeling,"Daniel Romero, Edward Platt, Herminio Bodon",Effective Deliberation in Large Groups: An Agent-Based Model,2020
Agent-based modeling,"Antonio Sirianni, Charles Gomez, Launy Schweiger",The Effects of Segregation and Integration in Diverse Collective-Problem Solving,2020
Agent-based modeling,"Doyne Farmer, Francois Lafond, Mariano Beguerisse-diaz, Penny Mealy, R. Rio-chanona",Occupational Mobility and Automation: A data-driven network model,2020
Agent-based modeling,"Aparna Ananthasubramaniam, Daniel Romero, David Jurgens",On the Localization of New Words on Twitter,2020
Agent-based modeling,"Poong Oh, Soojong Kim",How to Lie If You Must: The Evolutionary Dynamics of Trust and Deception,2020
Causal inference,"Alvin Zhou, Kokil Jaidka, Yphtach Lelkes",Experiments to improve online deliberation by manipulating social media affordances,2020
Causal inference,"Alex Pentland, Dean Eckles, Martin Saveski, Yan Leng",Observational causal inference using network information with unobserved confounding,2020
Causal inference,"Carlos Fernandez, Foster Provost",Observational vs Experimental Data When Making Automatic Decisions Using Machine Learning,2020
Causal inference,"Drew Dimmery, Yan Leng",Calibration of Heterogeneous Treatment Effect Models,2020
Causal inference,"Adam Berinsky, Ali Jadbabaie, Amir Tohidi, Dean Eckles, Manon Revel",The Effects of Native Advertisement on the U.S. News Industry,2020
Causal inference,"Francesco Rampazzo, Katherine Pham, Leah Rosenzweig, Matthewo Mildenberger, Parrish Bergquist",Quantity and/or Quality? An Assessment of Facebook surveys in Kenya and Mexico,2020
Collective intelligence and wisdom of crowds,"Jason Burton, Ulrike Hahn",Rewiring Social Networks for Collective Intelligence,2020
Collective intelligence and wisdom of crowds,"Alice Jang, Jesse Shore",Man-Bites-Dog Contagion,2020
Collective intelligence and wisdom of crowds,"Brian Uzzi, Mohammad Rasoolinejad",Shocks and Team Adaptation Strategies,2020
Collective intelligence and wisdom of crowds,"Albert Kao, Alex Rutherford, Iyad Rahwan, Niccolo Pescetelli",Adam Smith's fallacy: Collective rather than individual incentives drive optimal outcomes in news consumption,2020
Collective intelligence and wisdom of crowds,"Douglas Guilbeault, Joshua Becker, Samuel Woolley",Collective Intelligence Dynamics in the Spread of Misinformation,2020
Collective intelligence and wisdom of crowds,"Denis Helic, Florian Lemmerich, Markus Strohmaier, Tiago Santos",An Empirical Analysis of Video Game Reviews,2020
Complex networks 1,"Neil Johnson, Nicholas Johnson, Nicolas Velazquez-hernandez, Rhys Leahy, Yonatan Lupu",Online wormholes generate an expanding multiverse that quickly spreads and hides malicious matter and entraps individuals,2020
Complex networks 1,"Bruno Lepri, Federico Battiston, Giulia Cencetti, Marton Karsai",Temporal properties of higher-order networks of social interactions,2020
Complex networks 1,"Armin Pournaki, Eckehard Olbrich, Felix Gaisbauer, Sven Banisch",Observing political debates on Twitter: Introducing the twitter explorer,2020
Complex networks 1,"Farshad Kooti, Kristen Altenburger, Laila Wahedi",What Generates Deep Engagements?,2020
Complex networks 1,"Neil Johnson, Nicholas Johnson-restrepo, Nicolas Velasquez, Rhys Leahy, Yonatan Lupu",Social Network Analysis of Online Hate Groups Sharing Russian Propaganda Channels,2020
Complex networks 1,"Ana Brito, Diego Amancio, Filipi Silva",The Brazilian Chamber of Deputies as a complex network,2020
Complex networks 2,Daniel Putman,Risk Preferences and Risk Pooling in Networks: Theory and Evidence from Community Detection in Ghana,2020
Complex networks 2,Clara Hanson,Can we keep this between us? A simulation of negative network externalities in contact sharing,2020
Complex networks 2,"Caterina Gennaioli, Jianjian Gao, Pietro Panzarasa, Sam Fankhauser, Stefano Carattini",Structure and Evolution of the International Environmental Cooperation Network,2020
Complex networks 2,"Agnes Horvat, Henry Dambanemuya, Madhav Joshi",Efficient Pathways for Peace Accords Implementation: A Network Approach,2020
Complex networks 2,"Arthur Luhur, Beom Kim, Jaehyuk Park, Woo Jo, Yy Ahn",Hierarchical backbone of bipartite networks,2020
Complex networks 2,"Daniel Acuna, Tong Zeng",Large-scale author-name disambiguation using approximate network structures,2020
"Contagion, diffusion, and markets","Ji Kim, Milena Tsvetkova",The Contagion of Cheating in Online Gaming through Victimization and Observation,2020
"Contagion, diffusion, and markets",James Houghton,Interdependent Diffusion and its Effects on Societal Polarization and Worldview Emergence,2020
"Contagion, diffusion, and markets","Alex Arenas, Javier Borge-holthoefer, Josep Perello, Mario Gutierrez-roig",Mapping individual behavior in financial markets: synchronization and anticipation,2020
"Contagion, diffusion, and markets",Sebastian Steffen,"The Implied Market Values of Skills - Job Postings, Skill Demands, Automation",2020
"Contagion, diffusion, and markets","Daniel Mcfarland, Hancheng Cao, Mengjie Cheng, Xiang Ren, Zhepeng Cen",Will this Idea Spread Beyond Academia? Understanding and Forecasting Knowledge Transfer from Research to Practice,2020
"Contagion, diffusion, and markets","Alex Pentland, Burcin Bozkaya, Hasan Boz, Mohsen Bahrami, Selim Balcisoy, Yoshihiko Suhara",Merchant Financial Well-being Prediction Using Network Features,2020
Crowds,"Jacob Staerk-ostergaard, Robin Engelhardt",The Wisdom and Manipulability of Threads,2020
Crowds,"Kiran Garimella, Kirill Martynov, Robert West",The Effect of Clothing on Weight Perception,2020
Crowds,"Henner Gimpel, Manfred Schoch, Ricarda Schafer, Robert Laubacher","Curating a crowd that evaluates ideas to solve grand societal challenges: the role of quantity, specialization, and expertise",2020
Crowds,"Alex Pentland, Dhaval Adjodah, Esteban Moro, Peter Kraft, Shi Chong, Yan Leng",Evidence that Crowds Optimize for Risk not Accuracy using Social Learning,2020
Crowds,"Akira Matsui, Andres Abeliuk, Aram Galstyan, Emilio Ferrara, Fred Morstatter",Leveraging Clickstream Trajectories to Reveal Low-Quality Workers in Crowdsourced Forecasting Platforms,2020
Crowds,"Ceren Budak, Danaja Maldeniya, Daniel Romero, Lionel Robert",How GitHub Projects Respond to Increased Attention,2020
Culture and cognition,"Bryan Daniels, Chris Myers, David Krakauer, Edward Lee, Jessica Flack",Emergent regularities and scaling in armed conflict data,2020
Culture and cognition,"Alejandro Andrade, Anna Shvarts, Arthur Bakker, Dor Abrahamson, Lu Ou, Maria Bolsinova, Rosa Alberto",Knowing it early in embodied learning: Forecasting with hand-eye coordination,2020
Culture and cognition,"Ashton Anderson, Jon Kleinberg, Reid Mcilroy-young, Siddhartha Sen",Bridging the Gap between Superhuman AI and Human Behavior: Chess as a Model System,2020
Culture and cognition,"Alex Pentland, Dan Calacci",Ring Around the Neighborhood: Spatial Analysis of Doorbell Camera Use,2020
Culture and cognition,"Daniele Quercia, Luca Aiello, Milan Janosov",Rise and Fall of urban venues in London?,2020
Culture and cognition,"Alex Pentland, Felipe Montes, German Sanchez, Isabella Loaiza, Lina Ramos",Building Bridges: Analyzing Venezuelan integration in Colombia with mobile phone metadata,2020
Culture and fairness,"Florian Lemmerich, Ivan Smirnov, Markus Strohmaier",Quota-based debiasing of rankings could decrease overall fairness and worsen the representation of the most disadvantaged groups,2020
Culture and fairness,"Ashton Anderson, Ian Anderson, Lucas Maystre, Mounia Lalmas, Rishabh Mehrotra",Algorithmic Effects on the Diversity of Consumption on Spotify,2020
Culture and fairness,"Andrea Parker, Brooke Welles, Elizabeth Stowell, Ryan Gallagheer",Reclaiming Stigmatized Narratives: The Networked Disclosure Landscape of #MeToo,2020
Culture and fairness,"Agnese Chiatti, Andrew Fitzgerald, Byron Reeves, Jihye Lee, Katie Roehrick, Mu-jung Cho, Nilam Ram, Thomas Robinson, Xiao Yang, Xiaoran Sun",Parent-Young Adult Communication in the Digital World: A Screenomics Paradigm,2020
Culture and fairness,"Aaron Halfaker, Benjamin Hill, Nathante Teblunthuis",Algorithmic flags and identity-based signals in online community moderation,2020
Discrimination,"Naoki Maejima, Shohei Usui, Susumu Nagayama, Takanori Nishida",Magical Encounters in the Business Card Exchange Networks,2020
Discrimination,"Edwin Jonge, Jan Laan","The Importance of Work, Family, Neighbour and School Networks for Social Segregation",2020
Discrimination,"Emilio Ferrara, Emily Chen, Fred Morstatter, Julie Jiang, Kristina Lerman",Ageism in Traffic Policing Activity,2020
Discrimination,"Dan Jurafsky, Julia Mendelsohn, Yulia Tsvetkov",A Framework for the Computational Linguistic Analysis of Dehumanization,2020
Discrimination,"Allison Koencke, Andrew Nam, Connor Toups, Dan Jurafsky, Emily Lake, Joe Nudell, John Rickford, Minnie Quartey, Sharad Goel, Zion Mengesha",Racial Disparities in Automated Speech Recognition,2020
Discrimination,"Ashwin Rajadesingan, David Jurgens, Ramaswami Mahalingam",Measuring Caste Discrimination using Matrimonial Profiles,2020
Disinformation,"Antonio Arechar, David Rand, Dean Eckles, Gordon Pennycook, Mohsen Mosleh, Ziv Epstein",Understanding and reducing the spread of misinformation online,2020
Disinformation,"Alessandro Artoni, Francesco Pierri, Stefano Ceri",Anatomy of an Italian disinformation network on Twitter,2020
Disinformation,"Dean Eckles, Kiran Garimella",Images and Misinformation on WhatsApp in India,2020
Disinformation,"Ceren Budak, Lia Bozarth",Measuring Ideological Bias in Fake News Classifiers,2020
Disinformation,"Bedoor Alshebli, Gururaghav Raman, Jimmy Peng, Marcin Waniek, Talal Rahwan",Disinformation Attack on Urban Traffic Network,2020
Disinformation,"David Rand, Erin Wamsley, Graelyn Humiston",Deliberative thinking protects against the decay of corrections to misinformation,2020
Dynamics,"Matthewhew Turner, Paul Smaldino",Group polarization via stubborn extremism,2020
Dynamics,"Chris Riedl, Patrick Forber, Rory Smead, Zach Fulker",Preferential interaction and the emergence of spite,2020
Dynamics,"Alexandre Bovet, Anamika Shreeva, Anna Keuchenius, Chico Camargo, Irene Malvestio, Lea Brandt, Mikolaj Biesaga, Sabin Roman",Bringing Meaning into the Model: Opinion Dynamics as Associative Diffusion,2020
Dynamics,"Alfredo Morales, Dominic Saad, Mark Sutcliffe, Yaneer Bar-yam",Functional and Social Team Dynamics in Factories,2020
Dynamics,"Bryan Moser, Ira Winder, Jeff Dieffenbach, Katherine Carroll, Keran Rong, Prakash Manandhar, Roland Filippi",Sensors of teamwork and systems awareness in model-based design of complex infrastructures,2020
Dynamics,"John Scott, Renzhe Yu",Understanding the Co-Evolution of Collaboration and Engagement in Online Learning Networks,2020
Education,"Christoph Dann, Dustin Tingley, Emma Brunskill, Glenn Lopez, Joseph Williams, Justin Reich, Mike Yeomans, Rene Kizilcec, Selen Turkay",The Limits of Scalable Interventions: Evidence from 248 Online Courses,2020
Education,"Deb Roy, Doug Beeferman, Eric Chu, Nabeel Gillani",Getting schooled: exploring the relationship between US K-12 school reviews and quality,2020
Education,Berk Deniz,Impact of Failure on Search: Evidence from a Regression Discontinuity,2020
Education,"Daniel Goldstein, Forough Poursabzi-sangdeh, Jake Hofman, Siddhartha Sen",Expanding the scope of reproducibility research through data analysis replications,2020
Education,"Ceren Budak, Christopher Quarles, Paul Resnick",The Distribution of Educational Inequality,2020
Education,"Cristian Vallejos, Flavio Pinheiro, Joselina Davyt, Miguel Guevara",The higher education space can predict dropouts: Evidence from Chile,2020
Embeddings and applications,"Amir Goldberg, Paul Vicinanza, Sameer Srivastava",Corporate Seers: Discursive Prescience and Firm Stock Returns,2020
Embeddings and applications,"Jonathan Morgan, Kenneth Joseph",When do word embeddings accurately reflect surveys on our impressions of people?,2020
Embeddings and applications,Xin Jin,Using Text Mining to Examine the Role of Topics of Election Promises in Predicting Election Results,2020
Embeddings and applications,"Jisung Yoon, Kaicheng Yang, Woo-sung Jung, Yy Ahn",Persona2vec: Embedding networks with pervasively overlapping communities,2020
Embeddings and applications,"Ceren Budak, Daniel Romero, Hao Peng, Qing Ke, Yy Ahn",Neural Embeddings of Scholarly Periodicals Reveal Complex Disciplinary Organizations,2020
Embeddings and applications,"Craig Tutterow, James Evans, Lingfei Wu",Skill Embeddings Reveal Deep Complementarity of Human Capital for Career Advancement,2020
"Fairness, accountability, transparency","Azim Shariff, Edmond Awad, Iyad Rahwan, Jean-francois Bonnefon, Sohan Dsouza","Universals and variations in moral decisions made in 42 countries by 70,000 participants",2020
"Fairness, accountability, transparency","Diogo Pacheco, Filippo Menczer, Wen Chen",Hidden Bias in Social Media,2020
"Fairness, accountability, transparency","Claudia Wagner, Milena Tsvetkova, Oana Vuculescu",The Effect of Endowment and Wealth Visibility on Inequality,2020
"Fairness, accountability, transparency","Ashton Anderson, Lillio Mok",Relating Problematic Online-Platform Use with Actual and Self-Reported Time Spent,2020
"Fairness, accountability, transparency",Eni Mustafaraj,Google’s Top Stories and the ’Fairness Doctrine’,2020
"Fairness, accountability, transparency","Anindya Ghose, Panos Ipeirotis, Prasanna Parasurama",Who Benefits from Organizational Diversity Efforts? Evidence from Hiring in Silicon Valley Firms,2020
Gender,"Jason Jones, Jessica Kim, Mohammad Amin, Steven Skiena",Stereotypical Gender Associations in Language Have Decreased Over Time,2020
Gender,,Gender Prediction: Inference or Assumption?,2020
Gender,"Agnes Horvat, Yixue Wang",Gender Differences in Productivity and Success in the Music Industry,2020
Gender,"Agnes Horvat, Igor Zakhlebin, Orsolya Vasarhelyi, Stasa Milojevic",Gender diversity in collaboration networks and the online popularity of scientists,2020
Gender,"Antoine Mazieres, Camille Roth, Telmo Menezes",Computational appraisal of gender representativeness in popular movies using image analysis,2020
Gender,"Dorian Tsolak, Simon Kuhne",Gender Portrayal on Instagram,2020
Health,"Christopher Danforth, Jeanie Lim, Kelsey Linnell, Peter Dodds, Thayer Alshaabi, Tom Mcandrew",Estimating sleep opportunity lost during “spring forward” daylight savings events from tweets,2020
Health,"Florian Cafiero, Jeremy Ward, Paul Guille-escuret","""I'm not an antivaxxer, but…"": Spurious and authentic diversity among vaccine-critical activists",2020
Health,"Alex Pentland, Christos Nicolaides, Dean Eckles, Yuan Yuan",Who Motivate More Workouts: Friends or Strangers?,2020
Health,"Anne Stupinski, Christopher Danforth, Peter Dodds, Thayer Alshaabi",Measuring Mental Health Stigma on Twitter,2020
Health,"Amit Sheth, Krishnaprasad Thirunarayan, Maninder Kalra, Marco Valtorta, Utkarshani Ja",Is It Safe for My Child’s Asthma?,2020
Health,"Anna Tedijanto, Anneke Buffone, H , Rediet Abebe, Salvatore Giorgi",Quantifying Community Characteristics of Maternal Mortality,2020
Keynote,Andrea Baronchelli,Keynote 1: Andrea Baronchelli,2020
Keynote,Nicholas Beauchamp,Keynote 2: Nicholas Beauchamp,2020
Keynote,Tanya Berger-wolf,Keynote 3: Tanya Berger-Wolf,2020
Keynote,Joshua Blumenstock,Keynote 4: Joshua Blumenstock,2020
Keynote,Ceren Budak,Keynote 5: Ceren Budak,2020
Keynote,Daniel Chen,Keynote 6: Daniel Chen,2020
Keynote,Raj Chetty,Keynote 7: Raj Chetty,2020
