"Type","Speaker","Topic","Year"
"Social Dynamics and Influence","Corentin Vande Kerckhove, Samuel Martin, Pascal Gend, Julien M Hendrick","The Unpredictability of Human Opinion Dynamics",2016
"Keynote","Dirk Brockmann","Experimental Epidemiology - Measuring What Matters in Disease Dynamics",2016
"Keynote","Susan Athey","Keynote",2016
"Keynote","Balazs Vedres","Fold Networks and Success with Innovation",2016
"Keynote","Michael Kearns","Private Search in Social Networks",2016
"Keynote","Alessandro Lomi","Keynote",2016
"Collective Action","Joshua Mausolf","Occupy The Government: Presidential and Congressional Rhetorical Response to the Occupy Movement",2016
"Collective Action","Brooke Foucault Welles, Sarah Jackson","The Networked Battle for #Baltimore: A Mixed-Methods Exploration of the Framing of Urban Unrest",2016
"Collective Action","Han Zhang","Causal Effect of Witnessing Political Protest on Civic Engagement",2016
"Art and Music","Dmitry Zinoviev","Soviet Popular Music Landscape: Community Structure and Success Predictors",2016
"Art and Music","Arram Bae, Doheum Park, Yong-Yeol Ahn, Juyong Park","The Multi-Scale Network Landscape of Collaboration",2016
"Art and Music","Valerio Ciotti, Marco Serino, Noshir Contractor, Leslie Dechurch, Pietro Panzarasa","The Structural Foundations of Creativity: A Network-based Study of Coproductions Among Italian Theatres",2016
"Art and Music","Michael Mauskapf, Agnes Horvat, Noah Askin, Brian Uzzi","Understanding the Link Between Quality, Social Influence, and Success in Popular Music",2016
"Social Networks","Mark Newman, Aaron Clauset","Structure and Inference in Annotated Networks",2016
"Social Networks","Alexander Gutfraind, Ilya Safro, Lauren Meyers","Multiscale Network Generator",2016
"Social Networks","Eun-Kyeong Kim, Hang-Hyun Jo","Burstiness Parameter for Finite Event Sequences",2016
"Social Networks","Milena Tsvetkova, Ruth Garcia Gavilanes, Taha Yasseri","Dynamics of Disagreement: Large-Scale Temporal Network Analysis Reveals Negative Interactions in Online Collaboration",2016
"Cities and Mobility","Edmond Awad, Max Kleiman-Weiner, Sohan Dsouza, Jean-Francois Bonnefon, Azim Shariff, Josh Tenenbaum, Iyad Rahwan","Commission and Omission Decisions by Autonomous Vehicles in Moral Dilemmas",2016
"Cities and Mobility","Pierpaolo Mastroianni, Bernardo Monechi, Vito Servedio, Carlo Liberto, Gaetano Valenti, Vittorio Loreto","Local Optimization Strategies in Urban Mobility from Geo-referenced Floating Car Data",2016
"Cities and Mobility","Giovanni Ciampaglia, Jose J Ramasco, Bruno Goncalves","Night Life and Road Safety: A Comparison of 7 Italian Cities",2016
"Cities and Mobility","Aleix Bassolas, Maxime Lenormand, Antonia Tugores, Bruno Goncalves, Jose J Ramasco","Touristic Site Attractiveness Seen through Twitter",2016
"Information and Attention","Pablo Barrio, Daniel Goldstein, Jake Hofman","Improving Comprehension of Numbers in the News",2016
"Information and Attention","Ruth Garcia Gavilanes, Milena Tsvetkova, Taha Yasseri","Dynamics and Biases of Online Attention: The Case of Aircraft Crashes",2016
"Information and Attention","Azadeh Nematzadeh, Giovanni Ciampaglia, Yong-Yeol Ahn, Alessandro Flammini","From Conversation to Cacophony: Information Overload and Collective Communication in Twitch",2016
"Information and Attention","Alessandro Bessi, Michela Del Vicario, Ana Lucia Schmidt, Fabiana Zollo, Guido Caldarelli, Antonio Scala, Walter Quattrociocchi","Epidemiology of Misinformation Online",2016
"Language","Amir Goldberg, Sameer Srivastava, V Govind Manian, Christopher Potts","Enculturation Trajectories and Individual Attainment: An Interactional Language Use Model of Cultural Dynamics in Organizations",2016
"Language","John Shanahan, Robin Burke, Antonio Ceraso, Jessica Bishop-Royse","Data Sources for Modeling Library Texts and Readership",2016
"Language","Scott Hale","Roles of Bilinguals on User-generated Content Platforms",2016
"Crowd","Chien-Yi Hsiang, Albert Armisen, Sabine Brunswicker","Knowledge Reuse in Innovation Crowds: The Role of Semantic Heterogeneity",2016
"Crowd","Mary Gray, Siddharth Suri, Ming Yin, Jennifer Wortman Vaughan, Syed Shoaib Ali, Deepti Kulkarni","The Collaboration and Communication Networks within the Crowd",2016
"Crowd","Devon Brackbill, Joshua Becker, Damon Centola","The Danger of Opinion Leaders: How Social Influence Affects the Wisdom of Crowds",2016
"Crowd","Feng Shi, Misha Teplitskiy, Megan Barnes","Political Polarization of Science on Wikipedia",2016
"Security and Crime","Petter Holme, Yukie Sano","Network Effects in Team Assembly and Crime Ideation in Criminal Co-offender Networks",2016
"Security and Crime","Russell Thomas, Mathew Woodyard","Cyber Security as an Evolving Host-Parasite System",2016
"Security and Crime","Camelia Simoiu, Sam Corbett Davies, Sharad Goel","A Novel Statistical Test for Discrimination: Investigating Racial Disparities in Police Traffic Stop Data",2016
"Security and Crime","Sharad Goel, Justin Rao, Ravi Shroff","Personalized Risk Assessments in the Criminal Justice System",2016
"Social Networks","Brian Keegan","The Structure of Sequences: Mining and Interpreting Networks from Event Log Data",2016
"Social Networks","Youngsoo Park, Ayesha Mahmud, Samuel Carton, Kenneth Joseph, Jennifer Helsby, Joseph Walsh, Lauren Haynes, Rayid Ghani","On Predicting Adverse Police-Public Interactions",2016
"Social Networks","Samuel Fraiberger","Personality, Homophily and Embeddedness",2016
"Social Networks","Didem Gundogdu, Jacopo Staiano, Ailbhe N Finnerty, Stefano Teso, Andrea Passerini, Fabio Pianesi, Bruno Lepri","Investigating the Role of Social Interactions on Personality States Dynamics",2016
"Social Media","Abigail Jacobs, Samuel Way, Johan Ugander, Aaron Clauset","Natural Experiments in Online Social Network Assembly",2016
"Social Media","Fatema Akbar","When Did They Join Twitter? Patterns of Twitter Adoption for Different Nationality Groups in The Arab Gulf Countries",2016
"Social Media","Amac Herdagdelen, Winter Mason, Bogdan State, Lada Adamic","The Social Ties of Immigrant Communities in the United States",2016
"Economic Content Analysis","Miguel Acosta","FOMC Responses to Calls for Transparency",2016
"Economic Content Analysis","Aniko Hannak, Claudia Wagner, David Garcia, Alan Mislove, Markus Strohmaier, Christo Wilson","Measuring Discrimination in Online Freelance Marketplaces",2016
"Economic Content Analysis","Kevin Gaughan, Edward Bishop Smith","Better in the Shadows? Media Coverage and Market Reactions to Female CEO Appointments",2016
"Content Analysis","Steven Wilson, Ryan Boyd, Rada Mihalcea, James Pennebaker","Cultural Influences on the Measurement of Psychological Phenomena: Valuebehavior Relationships in India and the United States",2016
"Content Analysis","Jasy Suet Yan Liew, Kevin Crowston, Nancy McCracken","SOCQA: Active Machine Learning Tool for Qualitative Text Analysis",2016
"Content Analysis","Bo Cowgill","Human and Algorithmic Judgment in Resume Screening: Evidence from a Field Experiment",2016
"Keynote","Matthew Salganik","Experiments in the Digital Age",2016
"Keynote","David Ferrucci","AI: Episode II - The Quest for Understanding",2016
"Science of Science","Christian Persson, Ludvig Bohlin, Daniel Edler, Martin Rosvall","Mapping Science with Variable-order Markov Dynamics Reveal Overlapping Fields and Multidisciplinary Journals",2016
"Science of Science","Samuel Way, Daniel Larremore, Aaron Clauset","Trends and Gaps in Scholarly Productivity of Computer Science Faculty",2016
"Science of Science","Valentin Danchev, Jacob G Foster, James Evans","Weighting Experimental Claims to Leverage Scientific Exploration",2016
"Science of Science","Martin Gerlach, Laercio Dias, Eduardo G Altmann","Using Text Analysis to Quantify the Similarity and Evolution of Scientific Disciplines",2016
"Science of Science","James Evans, Peter McMahan","Ambiguity and Intellectual Engagement",2016
"Health and Wellbeing","Hyun Suk Kim, Sijia Yang, Minji Kim, Joseph Cappella","Assessing the Effectiveness of Recommendation Algorithms for Health Message Design: An Experiment",2016
"Health and Wellbeing","Nandana Sengupta, Aakanksha Sinha","Propensity Score Model Selection with an Application to India’s Safe Motherhood Scheme",2016
"Health and Wellbeing","Alexandra Olteanu, Onur Varol, Emre Kiciman","Distilling the Outcomes of Personal Experiences from Social Media Timelines",2016
"Health and Wellbeing","Takuto Sakamoto","Climate Change and African Pastoralists: A Computational Analysis",2016
"Political Content Analysis","Marshall Taylor, Ann Mische, Leslie MacColman","Topic Models as Affiliation Networks",2016
"Political Content Analysis","John J Nay","Distributed Representations of Institutions and Their Policy Text",2016
"Political Content Analysis","Yanchuan Sim, Bryan Routledge, Noah A Smith","Text Reveals Influence: The Case of Amicus Briefs and the Supreme Court",2016
"Political Content Analysis","Jennifer Stromer-Galley, Sikana Tanupabrungsun, Feifei Zhang, Jeff Hemsley, Nancy McCracken, Lauren Bryant, Brian Dobreski, Bryan Semaan","Strategic Changes in Gubernatorial Campaign Messaging Over Time: A Computational Analysis",2016
"Political Content Analysis","Ryan Whalen, Satyam Mukherjee, Brian Uzzi","Legal Evolution: Temporal Patterns of Precedent Citation & Judicial Opinion Impact",2016
"Political Content Analysis","Dallas Card, Amber Boydstun, Noah Smith","Automated Text Analysis to Unframe the News",2016
"Economic Models","Andrew Mao, Lili Dworkin, Siddharth Suri, Duncan Watts","Altruists Stabilize Cooperation in a Long-run Prisoner’s Dilemma Experiment",2016
"Economic Models","Alessio E Biondo, Alessandro Pluchino, Andrea Rapisarda","Modeling Financial Markets by Self-Organized Criticality",2016
"Economic Models","Morgan Frank, Lijun Sun, Manuel Cebrian, Hyejin Youn, Iyad Rahwan","Cities and Resilience to Automation: Specialization or Diversity?",2016
"Economic Models","Srayan Datta, Ceren Budak, Daniel Romero","From Local Popularity to Global Influence: A Computationally Effective Heuristic for Influence Maximization",2016
"Economic Models","Cyrus Dioun, Heather Haveman","Navigating Norms: Making Sense of Products in Contested Markets",2016
"Economic Models","Josep Perello, Jordi Duch, Carlota Segura, Mario Gutierrez-Roig","Market Imitation and Win-Stay Lose-Shift Strategies Emerge as Unintended Patterns in Market Direction Guesses",2016
"Success","Lu Liu, Yang Wang, Chaoming Song, Dashun Wang","Quantifying the Dynamical Impact of Individual Scientists",2016
"Success","Satyam Mukherjee, Yun Huang, Julia Neidhardt, Brian Uzzi, Noshir Contractor","Team Assembly Factors Influencing the Victor in Competitive Environment",2016
"Success","Quincy Stewart, Saheli Nath, Fabio Rojas","Acknowledging Gender Inequality in Sociology: A Network Analysis",2016
"Success","Brian Uzzi, Yang Yang, Kevin Gaughan","The Formation and Imprinting of Network Effects Among the Business Elite",2016
"Success","Mark Rouleau, Ashma Vaidya","ForestSim: Assessing the Sustainability of Bioenergy Production Using AgentBased Simulation",2016
"Success","Christine Cuskley, Bernardo Monechi, Pietro Gravino, Vittorio Loreto","The Emergence and Evolution of Collaborative Stories",2016
"Social Media","Xidao Wen, Yu-Ru Lin","The Distress Trajectories After A Terrorist Attack",2016
"Social Media","Jisun An, Ingmar Weber","Trend Spotting and Demographics in Twitter",2016
"Social Media","Eun-Kyeong Kim, Alan MacEachren","Spatial and Temporal Inhomogeneity of Geo-tagged Twitter Data",2016
"Social Media","Travis Martin, Jake Hofman, Amit Sharma, Ashton Anderson, Duncan Watts","Exploring Limits to Prediction in Complex Social Systems",2016
"Social Media","Daniel Kondor, Dimitrios Milioris","Unsupervised Classification in Twitter based on Joint Complexity",2016
"Social Media","Li Zeng, A Conrad Nied, Logan Walls, John Robinson, Kate Starbird, Emma Spiro","Automatic Misinformation Detection on Social Media Spaces during Crisis Events",2016
"Keynote","Shawndra Hill","Measuring the Impact of TV Content on Digital Behaviors",2016
"Keynote","Jon Kleinberg","Keynote",2016
"Poster","Jacob Fisher, Jonathon Cummings, Yong-Mi Kim","Abandoning Innovations: Network Evidence on Enterprise Collaboration Software",2016
"Poster","Shu-Heng Chen, Bin-Tzong Chie, Ying-Fang Kao, Timo Meyer, Ragupathy Venkatachalam","Agent-based Macroeconomic Models: Does Size Matter?",2016
"Poster","Lingxin Hao, Zhaohao Fu","Agent-based Modeling of Networks in China’s Rural-Urban Migration",2016
"Poster","Zining Yang","An Agent-based Dynamic Model of Politics, Fertility and Economic Development",2016
"Poster","Santa Agreste, Pasquale De Meo, Emilio Ferrara, Sebastiano Piccolo, Alessandro Provetti","Analysis of a Heterogeneous Social Network of Humans and Cultural Objects",2016
"Poster","Edmond Awad, Alex Rutherford, Manuel Garcia-Herranz, Iyad Rahwan","Analyzing Interactions of Syrian Refugees on Facebook Using Topic Modeling",2016
"Poster","Yuheng Hu, Kevin Hong","Analyzing Location Disclosure Behavior on Instagram",2016
"Poster","Junghwan Yang, Arash Sangari, Weiqi Zhang, Dhavan Shah","Applying Supervised Machine Learning to Compute Political Ideology Among Twitter Users",2016
"Poster","Vudtiwat Ngampruetikorn, Greg J Stephens","Bias, Belief and Consensus: Collective Opinion Formation on Fluctuating Networks",2016
"Poster","Seth Frey, Robert W Sumner, Maarten W Bos","Blind Moderation of User-generated Content in the Child-focused Use Case",2016
"Poster","Reid Johnson, Yuxiao Dong, Nitesh Chawla","Can Scientific Impact Be Predicted?",2016
"Poster","Yilang Peng","Can Self-disclosure Drive Online Activism? Personal Story, Selfie and the Loss of Collective Identity in Contemporary Activism",2016
"Poster","Michael Schnabel, Daniel Diermeier","Charting and Exploring the Opinion Space of Generic Spin Models on Arbitrary Network Topologies",2016
"Poster","Connie Wang, Shu-Heng Chen","Chinese University Admission Mechanisms: Should We Defer Deferred Acceptance?",2016
"Poster","Daniel Barkoczi, Mirta Galesic","Clarifying the Relationship Between Network Structure and Collective Problem Solving",2016
"Poster","Yuan Li, Bin Xiong","Community Detection in Dynamic Social Network with Node Attributes and Edge Content",2016
"Poster","Piotr Szymanski, Tomasz Kajdanowicz","Community Detection Methods form a Viable Alternative to Random Approach for Label Space Division in Multi-label Classification",2016
"Poster","Liangyue Li, Hanghang Tong, Nan Cao, Kate Ehrlich, Yu-Ru Lin, Norbou Buchler","Computational Methods to Enhance Team Composition in Networks",2016
"Poster","Xiaozhong Liu","Computational Student Information Need Estimation for Cyberreading",2016
"Poster","Roman Bartusiak , Tomasz Kajdanowicz","Cooperation Prediction in Github Developers Network",2016
"Poster","Radoslaw Michalski, Przemyslaw Kazienko, Marcin Kulisiewicz","Core Nodes As the Influencers in Temporal Social Networks",2016
"Poster","Takaaki Ohnishi, Akira Ishii, Keiko Toya","Correlation Between the Financial Evaluations and the Pagerank of Inter-firm Payment Flows Using Real Monetary Transaction Records Between Firms",2016
"Poster","Jacob Miller, David Gefen, Vk Narayanan","Creating Technological Frames: Latent Semantic Analysis of Discourse on Smartphones",2016
"Poster","Yoshihiko Suhara, Xiaowen Dong, Burcin Bozkaya, Alex Pentland","Deepshop: Understanding Purchase Patterns Via Deep Learning",2016
"Poster","Piotr Szymanski","Discovering the Co-authorship Network of 2nd Polish Republic Scientists Using Multiple Electronic Data Sources",2016
"Poster","Degang Wu, Kwok Yip Szeto","Does Having More Options Mean Harder to Reach Consensus?",2016
"Poster","Haris Memic, Robert Ackland","Dynamic Network Analysis of Australian Advocacy Groups on Twitter",2016
"Poster","Fujio Toriumi, Hitoshi Yamamoto, Isamu Okada","Effect of Rewarding Systems in Social Media",2016
"Poster","Yuki Ogawa, Hitoshi Yamamoto, Tetsuro Kobayashi, Takahisa Suzuki","Effects of Twitter Contacts on Perceived Distributions of Public Opinions",2016
"Poster","Eszter Bokanyi, Zoltan Labszki, Gabor Vattay","Estimating US County Unemployment Rates from Twitter Messages",2016
"Poster","Ryan Whalen, Noshir Contractor","Explorative Knowledge Search, Team Diversity, and Research Impact",2016
"Poster","Hedwig Lee, Tyler McCormick, Emma Spiro, Nina Cesare","Exploring Relationship Dynamics Between Citizens and the Police Via Twitter",2016
"Poster","Kazutoshi Sasahara","Exploring Semantic Structures of Online Collective Attention",2016
"Poster","Fredrik Erlandsson, Piotr Brodka, Anton Borg, Henric Johnson","Finding Influential Users in Social Media Using Rule Learning",2016
"Poster","Eshin Jolly, Luke Chang","The Function of Communication: Groups, Gossip and Social Dilemmas",2016
"Poster","Mohsen Jadidi, Fariba Karimi, Claudia Wagner, Markus Strohmaier","Gender Disparities in Scientific Collaboration Networks",2016
"Poster","Sucheta Soundarajan, Acar Tamersoy, Elias Khalil, Tina Eliassi-Rad, Duen Horng Chau, Brian Gallagher, Kevin Roundy","Generating a Sequence of Structurally Mature Networks from Streaming Edge Data",2016
"Poster","Dhaval Adjodah, Peter Krafft, Alejandro Noriega, Alex Pentland","Harnessing Social Learning to Improve Crowd-Sourced Prediction",2016
"Poster","Agnes Horvat, Jayaram Uparna, Brian Uzzi","Hidden Indicators of Collective Intelligence in Crowdfunding",2016
"Poster","Valerio Ciotti, Moreno Bonaventura, Pietro Panzarasa, Vincenzo Nicosia, Vito Latora","Homophily and Missing Links in Citation Networks",2016
"Poster","Moonhoon Choi, Ari Kim","How Crisis Spreads in Social Media and Affects the Attitude Toward the Host City of Mega Sports Event: In Case of Zika Virus and 2016 Brazil Olympic Games",2016
"Poster","Pouya Rahmati, Ali Tafti, Rui Guo, Chris Westland","How Do Firms Digitize Through Inter-firm Relationships? Network Positioning and Digital Complexity",2016
"Poster","James Evans, Misha Teplitskiy","How Firm Is Sociological Knowledge? Reanalysis of GSS Findings with Alternative Models and Out-of-Sample Data, 1972-2012",2016
"Poster","Dmytro Karamshuk, Tetyana Lokot, Oleksandr Pryymak, Nishanth Sastry","Identifying Partisanship in News Articles and Twitter Using Natural Language Processing",2016
"Poster","Yilin Zhang, Karl Rohe, Chris Wells","Identifying Sub-populations of French Voters on Facebook with Spectral Contextualization",2016
"Poster","Jacqueline Ng, Seyed Iravani, Noshir Contractor","The Impact of a Graphical Network Interface for Online Discussions on Student Learning",2016
"Poster","Eun Lee, Petter Holme","The Influence of Heterogeneous Threshold in Opinion Dynamics",2016
"Poster","Mark Costa","The Interdependence of Scientists in Team Science Environments",2016
"Poster","Natalie Herbert, Soojong Kim, Damon Centola","Is Inequality Inevitable? An Agent-based Bargaining Model of Network Structure and Nominal Characteristic Tags",2016
"Poster","Roman Bartusiak, Tomasz Kajdanowicz","Large Scale Network Measures Computation Using Bulk Synchronous Parallel Approach in Comparison to Centralized Methods",2016
"Poster","Pietro Gravino, Cesare Bianchi, Bernardo Monechi, Vito D P Servedio, Vittorio Loreto","LEGO Pixel Art: Identifying Creativity Through a Web-based Game-shaped Experiment",2016
"Poster","Fredrik Jansson, Pontus Strimling, Irina Vartanova, Kimmo Eriksson","The Moral Psychology of Liberals and Conservatives Can Predict Public Opinion Dynamics",2016
"Poster","Alessio E Biondo","A Multi-Quantity Order Book Model",2016
"Poster","Jaimie Murdock, Colin Allen, Simon Dedeo","Production and Consumption of Victorian Science in Charles Darwin's Scientific Practice",2016
"Poster","Clement Thibert, Sevil Zeynali, Matthieu Quignard, Jean-Philippe Mague","Linguistic Variability Among Communities of French Speaking Twitter Users",2016
"Poster","S M Niaz Arifin, Mei Li, Sarv Devaraj, Gregory Madey","Managed Healthcare: Modeling Decision Processes by Physician Groups Within Healthcare Supply Networks",2016
"Poster","Rebecca Jen-Hui Wang","Managing Loyalty Programs in the Mobile and Digital Era: An Empirical Study",2016
"Poster","Akira Ishii, Akiko Kitao","Mathematical Model for Hit Phenomena As a Tool of Computational Social Sciences",2016
"Poster","Daniel Citron, Samuel Way, Laurence Brandenberger","Measuring Topological Transitions in Scientific Collaboration Networks Using Topic Modeling for Subfield Detection",2016
"Poster","James Evans, Aaron Gerow, David Blei, Jordan Boyd-Graber, Yuening Hu","A Model of Author and Institution Textual Influence",2016
"Poster","Kenenbek Arzymatov, Igor Pospelov, Aleksandra Zhukova","Modeling of Financial Bubbles in Illiquid Market of Rational Agents",2016
"Poster","Yohsuke Murase, Hang-Hyun Jo, Janos Torok, Janos Kertesz, Kimmo Kaski","Modeling the Role of Relationship Fading and Breakup in Social Network Formation",2016
"Poster","Taraneh Khazaei, Lu Xiao, Robert Mercer, Atif Khan","Modelling Social Privacy Behavior in Twitter Data",2016
"Poster","Xiao Yang, Iadh Ounis, Craig Macdonald","Monitoring Electoral Violence Through Social Media: A Machine Learning Approach",2016
"Poster","Tse-Chuan Yang, Daniel Kifer, Stephen Matthews","Multiple Imputations of Subregions with Censored Location Data: A Kullback-Leibler Divergence Approach",2016
"Poster","Giuseppe Pappalardo, Tharsis T P Souza, Guido Caldarelli, Soong Moon Kang, Tomaso Aste","Multiplex Structure of Social Media and Financial Networks",2016
"Poster","Craig Evans, Jana Diesner","Mutual Impact and Stability of Personal Ethics and Structural Balance in a Communication Network Over Time",2016
"Poster","George Vega Yon, Stephanie Dyal, Timothy Hayes, Thomas Valente","Network Diffusion of Innovations in R: Introducing Netdiffuser",2016
"Poster","Yu Cheng, Yu-Ru Lin, Hanghang Tong","A Network Regression Framework for Forecasting Labor Transitions",2016
"Poster","Benjamin Smith, Andrea Figueroa-Caballero, Michael Stohl","Networks of Terror: A Computational Approach to Studying the Communicatively Constituted Terrorist Actor",2016
"Poster","Tharsis T P Souza, Tomaso Aste","A Nonlinear Impact: Evidences of Causal Effects of Social Media on Market Prices",2016
"Poster","Alessio E Biondo, Alfio Giarlotta, Alessandro Pluchino, Andrea Rapisarda","Perfect Information Vs Random Investigation: Safety Guidelines for a Consumer in the Jungle of Product Differentiation",2016
"Poster","Silvia Fierascu, Balazs Vedres","Politicized Business Groups and Collusion in Public Procurement Contracts",2016
"Poster","Subrina Farah","Powerful Impacts of a Specialized Academic Intervention Program: A Big Data Approach",2016
"Poster","Shuqing Gao, Hao Chen, Kaisheng Lai, Guo-An Yue, Weining Qian","Predicting Regional Variations of Nationalism with Online Expression of Disgust Emotion in China",2016
"Poster","Zhiya Zuo, Xi Wang, Kang Zhao, David Eichmann","The Prevalence and Interdisciplinarity of Collaborations in Multidisciplinary Institutions – A Case Study of iSchools",2016
"Poster","Xiaowen Dong, Eaman Jahani, Burcin Bozkaya, Bruno Lepri, Alex Pentland","Purchase Pattern, Socioeconomic Status, and Political Inclination",2016
"Poster","Luiz G A Alves, Renio Dos Santos Mendes, Ervin Lenzi, Haroldo Ribeiro","Quantifying and Predicting the Performance of Cities Via Scale-adjusted Metrics",2016
"Poster","David O'Sullivan, Mariano Beguerisse-Diaz, Guillermo Garduno, James Gleeson","Quantifying Interactions Among Twitter Users Based on Sentiment, Affinities, and Relationships, Using Data from the Irish Marriage Referendum",2016
"Poster","Przemyslaw Grabowicz, Mahmoudreza Babaei, Juhi Kulshrestha, Krishna Gummadi, Ingmar Weber","The Road to Popularity: The Dilution of Growing Audience on Twitter",2016
"Poster","Fredrik Jansson, Gunn Elisabeth Birkelund","Segregation Within School Classes: Deriving Social Ties from Register Data",2016
"Poster","Andrea Rapisarda, Alessandro Pluchino, Dario Zappala","Selective Altruism in Collective Games with Different Network Topologies",2016
"Poster","Lukasz Augustyniak, Tomasz Kajdanowicz, Roman Bartusiak, Piotr Szymanski","Sentiment Analysis Using Community Detection in Big Unlabeled Corpora",2016
"Poster","Jaroslaw Jankowski, Piotr Brodka, Tomasz Kajdanowicz, Przemyslaw Kazienko, Boleslaw Szymanski, Radoslaw Michalski","Sequential Seeding in Social Networks",2016
"Poster","Seth Frey, Karsten Donnay, Dirk Helbing, Bob Sumner, Maarten Bos","The Social Dimensions of Self-influence in a Young Online Population",2016
"Poster","Sara Soderstrom, Brian Uzzi, Derek Rucker, James Fowler, Daniel Diermeier","Social Influence Effects on the Adoption of Innovations Over Their Lifecycle",2016
"Poster","Peter Krafft, Nicolas Della Penna, Alex Pentland","Social Influence in Cryptocoin Markets: A Randomized Field Experiment",2016
"Poster","Nicholas Peiper, Rob Chew, Peter Baumgartner","Social-Ecology Meets Twitter: A Sociocentric Analysis of Medical Marijuana Dispensaries in Two California Communities",2016
"Poster","Yohsuke Murase, Takeshi Uchitane, Nobuyasu Ito","A Software Framework for Parameter-Space Explorations",2016
"Poster","Spyros Angelopoulos, Yasmin Merali","Sometimes a Cigar Is Not Just a Cigar: Exploring the Entanglement of Online Sociability and Offline Interactivity on Online Communities",2016
"Poster","Marco De Nadai, Xiaowen Dong, Roberto Larcher, Alex Pentland, Bruno Lepri","Spatial Structure of Cities: How Neighborhoods' Activity Patterns Shape Inequality and Polycentricity",2016
"Poster","Julia Poncela-Casasnovas, Brian Uzzi","The Spread of Negative Links in Social and Economic Networks",2016
"Poster","Sijia Yang, Hyun Suk Kim, Poong Oh, Minji Kim, Joseph Cappella","Tailoring by “Cloning”: Comparing Four Collaborative Filtering Algorithms to Effectively Recommend Anti-Smoking Health Messages",2016
"Poster","Antonis Matakos, Panayiotis Tsaparas","Temporal Mechanisms of Polarization in Online Reviews",2016
